HNRA,HNR Acquisition Corp,2/10/2022,"$121,779,188 ",N,0,1,1.03,10.47,"11,631,250","1,479",0.01%,Analyze,
FEXD,Fintech Ecosystem Development Corp. Class A,1/11/2022,"$121,803,337 ",N,0,1.01,1.04,10.51,"11,557,500","21,109",0.18%,Analyze,
MACA,Moringa Acquisition Corp Class A,4/6/2021,"$122,914,800 ",N,0,1.01,1.03,10.26,"11,980,000","46,574",0.39%,Analyze,
VCKA,Vickers Vantage Corp. I,3/3/2021,"$123,207,199 ",N,-13.38,0.9,0.88,9.01,"13,176,395","117,600",0.89%,Analyze,
NLIT,Northern Lights Acquisition Corp. - Class A,8/18/2021,"$124,010,484 ",N,0,1.01,1.02,10.31,"12,028,175","61,251",0.51%,Analyze,
BWAQ,Blue World Acquisition Corporation Class A,3/15/2022,"$124,550,237 ",N,0,1.01,1.03,10.39,"11,964,480","1,587",0.01%,Analyze,
GMFI,Aetherium Acquisition Corp. Class A,10/10/2017,"$124,855,830 ",N,0,1,1.03,10.36,"12,028,500","136,970",1.14%,Analyze,
EVOJ,Evo Acquisition Corp. Class A,4/1/2021,"$125,255,010 ",N,0,0.99,1.01,10.02,"12,500,500",133,0.00%,Analyze,
EVGR,Evergreen Corporation - Class A,4/1/2022,"$125,498,975 ",N,0,1.03,1.04,10.42,"12,032,500",710,0.01%,Analyze,
KYCH,Keyarch Acquisition Corporation,3/2/2022,"$126,123,500 ",N,0,1,1.03,10.27,"12,245,000","3,533",0.03%,Analyze,
LIBY,Liberty Resources Acquisition Corp. Class A,12/27/2021,"$126,317,888 ",N,0,1.01,1.04,10.49,"12,030,275","96,210",0.80%,Analyze,
ENCP,Energem Corp Class A,1/10/2022,"$126,775,911 ",N,0,1.01,1.04,10.54,"12,028,075","1,300",0.01%,Analyze,
FTII,FutureTech II Acquisition Corp. - Class A,4/8/2022,"$126,811,534 ",N,0,1.01,1.03,10.44,"12,135,075","12,389",0.10%,Analyze,
SAGA,Sagaliam Acquisition Corp. Class A,2/10/2022,"$126,878,400 ",N,0,1,1.04,10.44,"12,015,000","1,374",0.01%,Analyze,
JMAC,Maxpro Capital Acquisition Corp. Class A,11/26/2021,"$128,454,296 ",N,0,0.86,0.87,8.85,"10,840,025","64,836",0.60%,Analyze,
LMAO,LMF Acquisition Opportunities Inc. - Class A,3/18/2021,"$129,100,725 ",N,0,1.4,1.24,12.35,"10,453,500","560,236",5.36%,Analyze,
GSQB,G Squared Ascend II Inc. Class A,8/5/2021,"$129,169,669 ",N,0,1,1.03,10.34,"12,492,231","135,393",1.08%,Analyze,
IGTA,Inception Growth Acquisition Limited,1/21/2022,"$129,675,780 ",N,0,1,1.02,10.2,"12,725,788","468,621",3.68%,Analyze,
NUBI,Nubia Brand International Corp. - Class A,5/1/2022,"$130,847,015 ",N,0,1.01,1.02,10.48,"12,473,500","7,436",0.06%,Analyze,
CCTS,Cactus Acquisition Corp. 1 Limited - Class A,12/30/2021,"$132,066,000 ",N,0,1,1.03,10.43,"12,650,000","217,899",1.72%,Analyze,
FRBN,Forbion European Acquisition Corp. Class A,1/31/2022,"$132,572,000 ",N,0,1.01,1.03,10.46,"12,650,000","18,141",0.14%,Analyze,
AVHI,Achari Ventures Holdings Corp. I,11/17/2021,"$133,750,000 ",N,0,1.03,1.06,10.7,"12,500,000",100,0.00%,Analyze,
PONO,Pono Capital Corp Class A,10/8/2021,"$135,381,009 ",N,0,1.41,1.53,15.75,"12,251,675","120,427",0.98%,Analyze,
LATG,LatAmGrowth SPAC Class A,3/16/2022,"$135,720,000 ",N,0,1.01,1.03,10.46,"13,000,000","125,716",0.97%,Analyze,
EUCR,Eucrates Biomedical Acquisition Corp.,12/28/2020,"$136,610,109 ",N,0,1.01,1.01,10.07,"13,459,124",110,0.00%,Analyze,
MEOA,Minority Equality Opportunities Acquisition Inc. Class A,10/17/2021,"$137,687,344 ",N,0,1.02,1.05,10.79,"12,808,125","2,505",0.02%,Analyze,
IBER,Ibere Pharmaceuticals Class A,4/19/2021,"$140,760,000 ",N,0,1,1.02,10.21,"13,800,000",548,0.00%,Analyze,
FLAC,Frazier Lifesciences Acquisition Corporation Class A,2/8/2021,"$141,150,870 ",N,0,1,0.99,9.87,"14,301,000","13,488",0.09%,Analyze,
REVE,Alpine Acquisition Corporation,10/21/2021,"$142,004,000 ",N,0,0.99,1.02,10.49,"13,550,000","158,518",1.17%,Analyze,
EBAC,European Biotech Acquisition Corp. - Class A,5/11/2021,"$142,006,210 ",N,0,1.1,1.13,11.19,"13,209,880","48,657",0.37%,Analyze,
PRBM,Parabellum Acquisition Corp. Class A,10/26/2021,"$144,612,500 ",N,0,1.02,1.01,10.1,"14,375,000","9,200",0.06%,Analyze,
MURF,Murphy Canyon Acquisition Corp. - Class A,3/28/2022,"$145,521,390 ",N,0,1,1.02,10.37,"13,979,000",517,0.00%,Analyze,
ROSE,Rose Hill Acquisition Corporation Class A,12/6/2021,"$146,058,471 ",N,0,0.99,0.76,10.36,"14,098,308","1,165",0.01%,Analyze,
JAQC,Jupiter Acquisition Corporation,10/1/2021,"$146,728,752 ",N,0,1.01,1.04,10.14,"14,570,879","11,799",0.08%,Analyze,
AXH,"Industrial Human Capital, Inc.",5/26/2005,"$146,912,500 ",N,0,1,1.01,10.22,"14,375,000",400,0.00%,Analyze,
AMCI,AMCI Acquisition Corp. II Class A,2/22/2021,"$148,650,000 ",N,0,0.99,1.01,9.97,"15,000,000","30,627",0.20%,Analyze,
PTIC,PropTech Investment Corporation II Class A,1/25/2021,"$149,040,000 ",N,0,1.07,1.08,10.75,"23,000,000","36,317",0.16%,Analyze,
GIAC,Gesher I Acquisition Corp. Class A,11/9/2021,"$149,103,708 ",N,0,1,1.02,10.23,"14,575,000","34,100",0.23%,Analyze,
GLTA,Galata Acquisition Corp. Class A,8/11/2021,"$149,212,500 ",N,0,1,1.03,10.38,"14,375,000","2,872",0.02%,Analyze,
HSAQ,Health Sciences Acquisitions Corporation 2,8/4/2020,"$149,233,277 ",N,0,1.02,1.02,10.2,"11,212,117","15,234",0.14%,Analyze,
WAVS,Western Acquisition Ventures Corp.,4/10/2022,"$150,460,200 ",N,116.93,0.99,1.01,10.2,"14,751,000","2,205",0.01%,Analyze,
YOTA,Yotta Acquisition Corporation,6/26/2022,"$151,158,985 ",N,0,1.01,1.03,10.27,"14,718,499","11,455",0.08%,Analyze,
YOTAR,Yotta Acquisition Corporation Right,6/26/2022,"$151,158,985 ",N,0,0.88,1.33,0.15,"14,718,499","30,393",0.21%,Analyze,
APMI,AxonPrime Infrastructure Acquisition Corporation Class A,10/4/2021,"$151,500,000 ",N,0,1,1.03,10.1,"15,000,000","20,890",0.14%,Analyze,
BTWN,Bridgetown Holdings Limited - Class A,12/7/2020,"$151,911,387 ",N,0,1,1.01,10.04,"15,093,034","23,011",0.15%,Analyze,
ROCL,Roth CH Acquisition V Co.,1/5/2022,"$152,815,950 ",N,0,1.01,1.03,10.29,"14,836,500","46,368",0.31%,Analyze,
MITA,Coliseum Acquisition Corp. Class A Ordinary Share,1/3/2000,"$153,150,000 ",N,0,1,1.03,10.21,"15,000,000","58,806",0.39%,Analyze,
RWOD,Redwoods Acquisition Corp.,4/28/2022,"$153,670,550 ",N,0,1.01,1.03,10.31,"14,905,000","60,663",0.41%,Analyze,
ALSA,Alpha Star Acquisition Corporation,7/10/2012,"$153,726,495 ",N,0,1,1.04,10.47,"14,675,000","45,766",0.31%,Analyze,
MSSA,Metal Sky Star Acquisition Corporation,5/30/2022,"$153,814,300 ",N,0,1.01,1.04,10.46,"14,705,000","4,374",0.03%,Analyze,
OCAX,OCA Acquisition Corp. - Class A,3/8/2021,"$154,433,500 ",N,0,1,1.02,10.31,"14,950,000","10,554",0.07%,Analyze,
CCAI,Cascadia Acquisition Corp. Class A,10/18/2021,"$155,250,000 ",N,0,0.98,1.04,10.38,"15,000,000","116,776",0.78%,Analyze,
JWAC,Jupiter Wellness Acquisition Corp. Class A,1/7/2022,"$155,431,850 ",N,0,1.01,1.04,10.53,"14,705,000","22,763",0.15%,Analyze,
PIAI,Prime Impact Acquisition I Class A,11/2/2020,"$155,442,588 ",N,0,1,1.03,10.44,"14,896,271","7,443",0.05%,Analyze,
BLNG,Belong Acquisition Corp. Class A,9/13/2021,"$155,500,000 ",N,0,1,1.01,10.02,"15,550,000","1,504",0.01%,Analyze,
GLLI,Globalink Investment Inc.,12/23/2021,"$155,726,900 ",N,0,1,1.03,10.36,"14,945,000","26,751",0.18%,Analyze,
SMAP,SportsMap Tech Acquisition Corp.,10/16/2014,"$156,068,500 ",N,0,1,1.03,10.36,"15,050,000",990,0.01%,Analyze,
BMAQ,Blockchain Moon Acquisition Corp.,11/4/2021,"$156,197,192 ",N,0,1.02,1.07,10.72,"14,805,000","6,337",0.04%,Analyze,
ATAQ,Altimar Acquisition Corp. III Class A,4/26/2021,"$156,648,803 ",N,0,1,1.01,10.09,"15,525,000","145,105",0.93%,Analyze,
ARYE,ARYA Sciences Acquisition Corp V - Class A,7/13/2021,"$157,579,800 ",N,0,1,1.03,10.17,"15,449,000","2,323",0.02%,Analyze,
ABGI,ABG Acquisition Corp. I - Class A,2/17/2021,"$158,464,934 ",N,0,1,1.03,10.19,"15,566,300","2,115",0.01%,Analyze,
ARYD,ARYA Sciences Acquisition Corp IV - Class A,2/26/2021,"$159,124,700 ",N,0,1.01,1.03,10.3,"15,449,000","11,981",0.08%,Analyze,
DKDCA,Data Knights Acquisition Corp. - Class A,6/23/2021,"$159,326,929 ",N,0,1.02,1.03,10.67,"14,960,275","2,713",0.02%,Analyze,
BNNR,Banner Acquisition Corp. Class A,10/29/2021,"$160,611,000 ",N,0,1,1.02,10.21,"15,700,000","61,071",0.39%,Analyze,
ALPA,Alpha Healthcare Acquisition Corp. III Class A,12/6/2002,"$160,988,808 ",N,0,1,1.03,10.1,"15,907,985",817,0.01%,Analyze,
CLOE,Clover Leaf Capital Corp. - Class A,9/9/2021,"$162,707,450 ",N,0,1.02,1.06,11.03,"14,645,135","1,872",0.01%,Analyze,
RCAC,Revelstone Capital Acquisition Corp. Class A,2/7/2022,"$168,630,000 ",N,0,1,1.03,10.22,"16,500,000","22,335",0.14%,Analyze,
SCMA,Seaport Calibre Materials Acquisition Corp. Class A,12/20/2021,"$168,837,500 ",N,0,1.01,1.03,10.39,"16,250,000","15,293",0.09%,Analyze,
TWCB,Bilander Acquisition Corp. - Class A,9/8/2021,"$169,190,044 ",N,0,1,1.03,10.04,"16,851,598","125,096",0.74%,Analyze,
SAMA,Schultze Special Purpose Acquisition Corp. II Class A,12/28/2020,"$169,455,000 ",N,0,1.01,1.03,10.28,"16,500,000","5,224",0.03%,Analyze,
BSAQ,Black Spade Acquisition Co Class A,9/7/2021,"$172,380,000 ",N,0,1,1.03,10.21,"16,900,000","54,332",0.32%,Analyze,
PEPL,PepperLime Health Acquisition Corporation Class A Ordinary Share,7/14/2003,"$173,060,000 ",N,0,1,1.02,10.18,"17,000,000","8,230",0.05%,Analyze,
NBST,Newbury Street Acquisition Corporation,4/16/2021,"$173,116,102 ",N,0,1.01,1.04,10.25,"16,661,800","194,003",1.16%,Analyze,
CLBR,Colombier Acquisition Corp. Class A,7/7/2021,"$174,742,500 ",N,0,1,1.03,10.13,"17,250,000","405,953",2.35%,Analyze,
TCOA,Trajectory Alpha Acquisition Corp. Class A,1/31/2022,"$176,640,000 ",N,0,1,1.03,10.24,"17,250,000","59,401",0.34%,Analyze,
AFAC,Arena Fortify Acquisition Corp. Class A,12/31/2021,"$177,157,500 ",N,0,1,1.02,10.26,"17,250,000","30,990",0.18%,Analyze,
APN,Apeiron Capital Investment Corp. Class A,12/30/2021,"$178,882,500 ",N,0,1,1.02,10.37,"17,250,000",118,0.00%,Analyze,
ITAQ,"Industrial Tech Acquisitions II, Inc. Class A",3/3/2022,"$179,055,000 ",N,0,1,1.03,10.37,"17,250,000","16,468",0.10%,Analyze,
MEAC,Mercury Ecommerce Acquisition Corp Class A,9/16/2021,"$179,873,755 ",N,0,1.01,1.01,10.1,"18,041,500","2,740",0.02%,Analyze,
MNTN,Everest Consolidator Acquisition Corporation,1/14/2022,"$180,176,250 ",N,0,1,1.03,10.45,"17,250,000","124,731",0.72%,Analyze,
FNVT,Finnovate Acquisition Corp. Class A,12/8/2021,"$181,134,000 ",N,0,1.01,1.03,10.4,"17,400,000","1,871",0.01%,Analyze,
BRIV,B. Riley Principal 250 Merger Corp. Class A,6/28/2021,"$181,177,500 ",N,0,1,1.03,10.13,"17,850,000","16,711",0.09%,Analyze,
APCA,AP Acquisition Corp Class A,4/24/2018,"$181,470,000 ",N,0,1,1.03,10.52,"17,250,000","52,831",0.31%,Analyze,
APXI,APx Acquisition Corp. I Class A Ordinary Share,1/26/2022,"$181,470,000 ",N,0,1,1.03,10.49,"17,250,000","2,605",0.02%,Analyze,
PANA,Panacea Acquisition Corp. II Class A,8/24/2020,"$181,509,000 ",N,0,1,1.03,10.18,"17,795,000","101,883",0.57%,Analyze,
LSPR,Larkspur Health Acquisition Corp. Class A,2/9/2022,"$181,967,198 ",N,0,1.15,1.17,11.79,"8,087,431",335,0.00%,Analyze,
SEPA,SEP Acquisition Corp - Class A,9/17/2021,"$182,607,042 ",N,0,1.03,1.04,10.36,"18,041,500","6,099",0.03%,Analyze,
OXUS,Oxus Acquisition Corp. Class A,10/6/2021,"$183,573,000 ",N,0,1,1.03,10.45,"17,550,000","4,930",0.03%,Analyze,
RACY,Relativity Acquisition Corp. - Class A,4/4/2022,"$184,553,050 ",N,0,0.96,1.17,12.28,"15,028,750","46,424",0.31%,Analyze,
SGII,Seaport Global Acquisition II Corp. Class A,11/30/2021,"$184,718,750 ",N,0,1,1.01,10.22,"17,968,750","77,735",0.43%,Analyze,
JATT,JATT Acquisition Corp Class A,9/2/2021,"$185,437,500 ",N,0,1.04,1.06,10.75,"17,250,000","62,363",0.36%,Analyze,
ALOR,ALSP Orchid Acquisition Corporation I Class A Ordinary Share,1/10/2022,"$187,826,100 ",N,0,1,1.02,10.33,"18,165,000","29,431",0.16%,Analyze,
BYNO,byNordic Acquisition Corporation - Class A,4/1/2022,"$188,630,300 ",N,0,1,1.02,10.31,"18,190,000",575,0.00%,Analyze,
CFFS,CF Acquisition Corp. VII Class A,2/9/2022,"$193,171,000 ",N,0,1.01,1.03,10.31,"18,700,000","45,470",0.24%,Analyze,
CSLM,"Consilium Acquisition Corp I, Ltd. Class A Ordinary Share",3/7/2022,"$195,916,875 ",N,0,1.01,1.03,10.32,"18,975,000","182,801",0.96%,Analyze,
TPBA,TPB Acquisition Corporation I Class A,10/1/2021,"$196,595,659 ",N,0,1.07,1.08,10.75,"18,036,299","51,178",0.28%,Analyze,
PBAX,Phoenix Biotech Acquisition Corp.,11/26/2021,"$196,903,350 ",N,0,1.02,1.05,10.7,"18,385,000","4,685",0.03%,Analyze,
BOCN,Blue Ocean Acquisition Corp - Class A,1/24/2022,"$197,719,500 ",N,0,1,1.03,10.41,"18,975,000","146,638",0.77%,Analyze,
NHIC,NewHold Investment Corp. II Class A,12/13/2021,"$197,920,950 ",N,0,1,1.02,10.16,"19,490,000","48,204",0.25%,Analyze,
HMA,Heartland Media Acquisition Corp. Class A,3/13/2022,"$200,360,552 ",N,70.21,1,1.03,10.41,"19,246,931","127,165",0.66%,Analyze,
FVT,Fortress Value Acquisition Corp. III Class A,2/25/2021,"$201,000,000 ",N,0,1,1.01,10.05,"20,000,000","61,600",0.31%,Analyze,
CAS,Cascade Acquisition Corp. Class A,1/15/2021,"$201,800,000 ",N,0,1,1,10.09,"20,000,000","200,519",1.00%,Analyze,
TACA,Trepont Acquisition Corp I Class A,1/22/2021,"$202,000,000 ",N,0,1,1,10.1,"20,000,000","3,545",0.02%,Analyze,
LOCC,Live Oak Crestview Climate Acquisition Corp.,11/15/2021,"$202,002,000 ",N,0,1,1.03,10.1,"20,000,000","87,730",0.44%,Analyze,
BGSX,Build Acquisition Corp. Class A,5/6/2021,"$203,600,000 ",N,0,1,1.03,10.19,"20,000,000","126,914",0.63%,Analyze,
FST,FAST Acquisition Corp. Class A,10/12/2020,"$203,600,000 ",N,0,1,1,10.18,"20,000,000","1,756,123",8.78%,Analyze,
FICV,Frontier Investment Corp Class A,8/23/2021,"$204,200,000 ",N,0,1,1.04,10.21,"20,000,000","11,699",0.06%,Analyze,
HPLT,Home Plate Acquisition Corporation Class A,11/22/2021,"$204,400,000 ",N,0,1.01,1.03,10.22,"20,000,000","56,593",0.28%,Analyze,
ORIA,Orion Biotech Opportunities Corp. - Class A,7/2/2021,"$204,700,000 ",N,0,1,1.03,10.22,"20,000,000","167,536",0.84%,Analyze,
SEDA,SDCL EDGE Acquisition Corporation Class A,12/20/2021,"$205,351,176 ",N,0,1,1.03,10.25,"19,995,246",883,0.00%,Analyze,
ARTE,Artemis Strategic Investment Corporation Class A,11/22/2021,"$207,891,250 ",N,0,1,1.03,10.33,"20,125,000","8,886",0.04%,Analyze,
SHAP,Spree Acquisition Corp. 1 Limited,2/7/2022,"$208,200,000 ",N,0,1,1.03,10.45,"20,000,000","210,949",1.05%,Analyze,
CRZN,Corazon Capital V838 Monoceros Corp Class A,5/14/2021,"$208,445,617 ",N,0,1.01,1.03,10.2,"20,379,900","88,905",0.44%,Analyze,
PRLH,Pearl Holdings Acquisition Corp Class A,2/3/2022,"$208,800,000 ",N,0,1,1.03,10.41,"20,000,000","212,959",1.06%,Analyze,
GTAC,Global Technology Acquisition Corp. I - Class A,12/17/2021,"$209,000,000 ",N,0,1,1.03,10.43,"20,000,000","20,613",0.10%,Analyze,
MLAI,McLaren Technology Acquisition Corp. Class A,12/23/2021,"$209,098,750 ",N,0,1.01,1.03,10.39,"20,125,000","24,283",0.12%,Analyze,
GHAC,Gaming & Hospitality Acquisition Corp. - Class A,3/26/2021,"$209,125,538 ",N,0,1,1.02,10.06,"20,777,500","216,219",1.04%,Analyze,
DALS,DA32 Life Science Tech Acquisition Corp.,7/28/2021,"$209,184,500 ",N,0,1.01,1.03,10.12,"20,650,000","152,435",0.74%,Analyze,
ATAK,Aurora Technology Acquisition Corp. Class A,3/20/2022,"$209,272,000 ",N,0,1,1.03,10.35,"20,200,000","11,088",0.05%,Analyze,
VHNA,Vahanna Tech Edge Acquisition I Corp. Class A,1/13/2022,"$209,504,700 ",N,-34.64,1,1.03,10.41,"20,010,000","13,636",0.07%,Analyze,
APAC,StoneBridge Acquisition Corporation Class A,9/7/2021,"$209,600,000 ",N,0,1,1.03,10.48,"20,000,000","2,833",0.01%,Analyze,
WQGA,World Quantum Growth Acquisition Corp. Class A,10/1/2021,"$209,660,600 ",N,0,1,1.02,10.28,"20,395,000","20,721",0.10%,Analyze,
CREC,Crescera Capital Acquisition Corp Class A,1/10/2022,"$209,903,750 ",N,0,1.01,1.03,10.43,"20,125,000","42,443",0.21%,Analyze,
GEEX,Games & Esports Experience Acquisition Corp. - Class A,1/24/2022,"$210,000,000 ",N,0,1,1.03,10.49,"20,000,000","8,380",0.04%,Analyze,
GVCI,Green Visor Financial Technology Acquisition Corp. I Class A,12/30/2021,"$210,505,200 ",N,0,1.01,1.03,10.53,"20,010,000","111,392",0.56%,Analyze,
PHYT,Pyrophyte Acquisition Corp. Class A,12/17/2021,"$211,111,250 ",N,0,1,1.03,10.49,"20,125,000","110,728",0.55%,Analyze,
ASCB,A SPAC II Acquisition Corp.,5/30/2022,"$211,120,000 ",N,0,1,1.04,10.4,"20,300,000","310,275",1.53%,Analyze,
CDAQ,Compass Digital Acquisition Corp. Class A,12/6/2021,"$216,440,573 ",N,0,1.02,1.05,10.32,"21,240,488","3,665",0.02%,Analyze,
AVAC,Avalon Acquisition Inc. - Class A,12/3/2021,"$216,894,600 ",N,0,1,1.03,10.4,"20,855,250","210,906",1.01%,Analyze,
CENQ,CENAQ Energy Corp. Class A,10/4/2021,"$217,852,673 ",N,0,1.05,1.06,10.72,"20,927,250","54,761",0.26%,Analyze,
GFOR,Graf Acquisition Corp. IV,7/12/2021,"$217,951,050 ",N,0,1,1.03,10.16,"21,451,875","29,347",0.14%,Analyze,
TRCA,Twin Ridge Capital Acquisition Corp. Class A,4/26/2021,"$217,989,157 ",N,0,1,1.02,10.23,"21,308,813","78,709",0.37%,Analyze,
WAVC,Waverley Capital Acquisition Corp. 1 Class A,10/11/2021,"$218,738,057 ",N,-37.91,1,1.03,10.18,"21,487,039","358,212",1.67%,Analyze,
NGC,Northern Genesis Acquisition Corp. III,5/14/2021,"$218,795,938 ",N,0,1,1.02,10.15,"21,556,250","36,513",0.17%,Analyze,
TWOA,two Class A,3/30/2021,"$218,876,875 ",N,0,1,1.03,10.22,"21,437,500","159,783",0.75%,Analyze,
PIPP,Pine Island Acquisition Corp. Class A,1/7/2021,"$219,042,663 ",N,0,1,1.01,10.03,"21,838,750","290,948",1.33%,Analyze,
EQHA,EQ Health Acquisition Corp. Class A,3/22/2021,"$221,319,598 ",N,0,1,1.02,10.06,"21,999,960","7,149",0.03%,Analyze,
XPAX,XPAC Acquisition Corp. Class A,9/20/2021,"$223,344,702 ",N,-17.68,1,1.03,10.17,"21,961,131","391,110",1.78%,Analyze,
TGAA,Target Global Acquisition I Corp. Class A Ordinary Share,1/31/2022,"$224,244,581 ",N,0,1,1.03,10.42,"21,489,658","80,016",0.37%,Analyze,
HAIA,Healthcare AI Acquisition Corp. Class A,1/31/2022,"$224,464,594 ",N,0,1,1.03,10.41,"21,562,401","399,841",1.85%,Analyze,
PGRW,Progress Acquisition Corp. Class A,3/15/2021,"$224,507,250 ",N,0,1,1.03,10.33,"21,712,500",641,0.00%,Analyze,
GBBK,Global Blockchain Acquisition Corp.,6/16/2022,"$225,848,250 ",N,0,1.01,1.04,10.26,"22,012,500","58,830",0.27%,Analyze,
GBBKR,Global Blockchain Acquisition Corp. Right,6/15/2022,"$225,848,250 ",N,0,1.03,1.1,0.08,"22,012,500",301,0.00%,Analyze,
GAQ,Generation Asia I Acquisition Limited Class A,1/19/2022,"$226,098,300 ",N,0,1,1.03,10.34,"21,930,000","97,362",0.44%,Analyze,
SKYA,Skydeck Acquisition Corp. Class A,7/9/2021,"$226,203,642 ",N,0,1,1.03,10.19,"22,165,962","333,272",1.50%,Analyze,
SZZL,Sizzle Acquisition Corp.,1/31/2022,"$226,631,946 ",N,0,1,1.02,10.39,"21,770,600","9,376",0.04%,Analyze,
FZT,FAST Acquisition Corp. II Class A,5/6/2021,"$226,783,607 ",N,0,1,1.03,10.2,"22,233,687","10,826",0.05%,Analyze,
HCII,Hudson Executive Investment Corp. II Class A,3/18/2021,"$226,800,000 ",N,0,1,1.02,10.08,"22,500,000","25,812",0.11%,Analyze,
BWC,Blue Whale Acquisition Corp I Class A,9/24/2021,"$227,802,253 ",N,0,1.01,1.02,9.98,"22,940,811","21,393",0.09%,Analyze,
EGGF,EG Acquisition Corp. Class A,7/16/2021,"$227,925,000 ",N,0,1,1.03,10.13,"22,500,000","53,412",0.24%,Analyze,
CLAS,Class Acceleration Corp. Class A,3/8/2021,"$228,825,000 ",N,0,1.01,1.03,10.17,"22,500,000","72,515",0.32%,Analyze,
OSI,Osiris Acquisition Corp. Class A,7/6/2021,"$228,850,000 ",N,0,1,1.01,9.95,"23,000,000","8,460",0.04%,Analyze,
RJAC,Jackson Acquisition Company Class A,1/31/2022,"$228,952,500 ",N,0,1,1.03,10.29,"22,250,000","7,961",0.04%,Analyze,
GNAC,Group Nine Acquisition Corp. - Class A,3/8/2021,"$229,310,000 ",N,0,0.99,1.01,9.97,"23,000,000","18,357",0.08%,Analyze,
IPVA,InterPrivate II Acquisition Corp. Class A,4/25/2021,"$229,851,125 ",N,0,0.93,0.9,8.8,"26,075,000","8,671",0.03%,Analyze,
ARBG,Aequi Acquisition Corp.,1/11/2021,"$230,000,000 ",N,0,1,0.99,9.89,"23,000,000",101,0.00%,Analyze,
SWSS,Springwater Special Situations Corp.,9/23/2021,"$230,438,850 ",N,0,1,1.02,10.25,"22,481,839","4,214",0.02%,Analyze,
VMCA,Valuence Merger Corp. I - Class A,4/22/2022,"$231,324,711 ",N,0,1,1.03,10.53,"22,009,963","127,685",0.58%,Analyze,
LHAA,Lerer Hippeau Acquisition Corp. - Class A,3/5/2021,"$231,351,211 ",N,0,1,1.02,10.08,"22,951,509",598,0.00%,Analyze,
IVCP,Swiftmerge Acquisition Corp. Class A Ordinary Share,2/3/2022,"$231,975,000 ",N,0,1,1.03,10.31,"22,500,000","11,544",0.05%,Analyze,
TMAC,The Music Acquisition Corporation Class A,3/26/2021,"$232,300,000 ",N,0,1,1.02,10.1,"23,000,000","1,151",0.01%,Analyze,
HWKZ,Hawks Acquisition Corp,11/29/2021,"$233,910,000 ",N,0,1,1.03,10.17,"23,000,000","228,706",0.99%,Analyze,
HTAQ,Hunt Companies Acquisition Corp. I,12/30/2021,"$234,370,000 ",N,0,1,1.01,10.19,"23,000,000","149,180",0.65%,Analyze,
PGSS,Pegasus Digital Mobility Acquisition Corp. Class A,12/13/2021,"$234,450,000 ",N,0,1,1.03,10.42,"22,500,000","93,433",0.42%,Analyze,
KAII,Kismet Acquisition Two Corp. Class A,4/12/2021,"$234,600,000 ",N,0,1,1.03,10.2,"23,000,000",364,0.00%,Analyze,
LDHA,LDH Growth Corp I - Class A,5/10/2021,"$234,830,000 ",N,0,1,1.03,10.2,"23,000,000","22,096",0.10%,Analyze,
QDRO,Quadro Acquisition One Corp. - Class A,2/27/2023,"$235,060,000 ",N,0,1,1,10.23,"23,000,000","5,281",0.02%,Analyze,
VLAT,Valor Latitude Acquisition Corp. Class A,6/23/2021,"$235,060,000 ",N,-15.56,1,1.03,10.22,"23,000,000","58,710",0.26%,Analyze,
LCW,Learn CW Investment Corporation Class A,12/16/2013,"$235,750,000 ",N,0,1,1.02,10.25,"23,000,000","6,287",0.03%,Analyze,
BHAC,Crixus BH3 Acquisition Company Class A,1/21/2020,"$236,440,000 ",N,0,1.01,1.03,10.28,"23,000,000","70,868",0.31%,Analyze,
IXAQ,IX Acquisition Corp. Class A Ordinary Share,11/29/2021,"$236,440,000 ",N,0,1,1.03,10.27,"23,000,000","452,453",1.97%,Analyze,
WWAC,Worldwide Webb Acquisition Corp. Class A Ordinary Share,12/10/2021,"$237,130,000 ",N,0,1,1.03,10.32,"23,000,000","339,000",1.47%,Analyze,
AXAC,AXIOS Sustainable Growth Acquisition Corporation Class A,2/15/2022,"$237,247,875 ",N,0,1,1.02,10.35,"22,922,500","95,730",0.42%,Analyze,
AXAC^,AXIOS Sustainable Growth Acquisition Corporation Rights to receive one-tenth (1/10) of one Class A,3/25/2022,"$237,247,875 ",N,0,1.01,1.29,0.18,"22,922,500","64,450",0.28%,Analyze,
TRIS,Tristar Acquisition I Corp. Class A,12/6/2021,"$237,590,000 ",N,0,1,1.03,10.33,"23,000,000","365,549",1.59%,Analyze,
VMGA,VMG Consumer Acquisition Corp. Class A,1/3/2022,"$237,590,000 ",N,-35.94,1,1.03,10.32,"23,000,000","254,146",1.11%,Analyze,
PORT,Southport Acquisition Corporation Class A,1/31/2022,"$237,820,000 ",N,0,1,1.03,10.38,"23,000,000","76,561",0.33%,Analyze,
VII,7GC & Co. Holdings Inc. - Class A,2/12/2021,"$238,050,000 ",N,-11.47,1.01,1.03,10.33,"23,000,000","1,557",0.01%,Analyze,
SVII,Spring Valley Acquisition Corp. II - Class A,10/28/2022,"$238,050,000 ",N,0,1.01,1.02,10.34,"23,000,000","188,425",0.82%,Analyze,
BRD,Beard Energy Transition Acquisition Corp. Class A,1/14/2022,"$238,062,938 ",N,0,1,1.03,10.35,"23,001,250","33,870",0.15%,Analyze,
AEAE,AltEnergy Acquisition Corp. Class A,12/13/2021,"$238,280,000 ",N,0,1,1.03,10.35,"23,000,000","28,213",0.12%,Analyze,
FIAC,Focus Impact Acquisition Corp. Class A,12/20/2021,"$238,510,000 ",N,0,1,1.03,10.36,"23,000,000","253,769",1.10%,Analyze,
JGGC,Jaguar Global Growth Corporation I - Class A,4/4/2022,"$238,740,000 ",N,0,1,1.03,10.38,"23,000,000","15,281",0.07%,Analyze,
CMCA,Capitalworks Emerging Markets Acquisition Corp Class A,1/21/2022,"$238,970,000 ",N,0,1,1.03,10.41,"23,000,000","45,805",0.20%,Analyze,
XFIN,ExcelFin Acquisition Corp Class A,12/13/2021,"$238,970,000 ",N,-31.09,1,1.03,10.37,"23,000,000","26,809",0.12%,Analyze,
USCT,TKB Critical Technologies 1 Class A,12/17/2021,"$238,970,000 ",N,0,1,1.02,10.39,"23,000,000","2,145",0.01%,Analyze,
UTAA,UTA Acquisition Corporation - Class A,1/24/2022,"$239,425,400 ",N,0,1,1.03,10.39,"23,000,000","31,364",0.14%,Analyze,
FLYA,SOAR Technology Acquisition Corp. Class A,11/8/2021,"$239,430,000 ",N,0,1,1.02,10.42,"23,000,000","1,936,201",8.42%,Analyze,
SVNA,7 Acquisition Corporation - Class A,12/23/2021,"$239,890,000 ",N,0,1,1.03,10.43,"23,000,000","119,743",0.52%,Analyze,
ADAL,Anthemis Digital Acquisitions I Corp Class A,12/27/2021,"$239,890,000 ",N,0,1,1.03,10.42,"23,000,000","263,595",1.15%,Analyze,
CBRG,Chain Bridge I Class A,1/11/2019,"$239,890,000 ",N,0,1,1.03,10.41,"23,000,000","3,562",0.02%,Analyze,
RCFA,RCF Acquisition Corp.,12/31/2021,"$239,890,000 ",N,0,1,1.02,10.43,"23,000,000","243,087",1.06%,Analyze,
SCUA,Sculptor Acquisition Corp I Class A,1/31/2022,"$239,890,000 ",N,0,1,1.03,10.43,"23,000,000","121,462",0.53%,Analyze,
DPCS,DP Cap Acquisition Corp I - Class A,12/30/2021,"$240,005,000 ",N,0,1.01,1.03,10.4,"23,000,000","83,604",0.36%,Analyze,
MPRA,Mercato Partners Acquisition Corporation Class A,12/27/2021,"$240,345,400 ",N,0,1,1.03,10.39,"23,000,000","10,414",0.05%,Analyze,
BPAC,Bullpen Parlay Acquisition Company Class A Ordinary Share,1/24/2022,"$240,350,000 ",N,0,1.01,1.03,10.45,"23,000,000","20,554",0.09%,Analyze,
SBII,Sandbridge X2 Corp. Class A,4/30/2021,"$240,558,780 ",N,0,1.01,1.03,10.15,"23,817,701","2,060",0.01%,Analyze,
KNSW,KnightSwan Acquisition Corporation,1/20/2022,"$240,580,000 ",N,0,1,1.03,10.41,"23,000,000","130,539",0.57%,Analyze,
TLGY,TLGY Acquisition Corporation Class A Ordinary Share,1/21/2022,"$240,580,000 ",N,0,1,1.03,10.47,"23,000,000","2,966",0.01%,Analyze,
DSAQ,Direct Selling Acquisition Corp.,11/12/2021,"$240,810,000 ",N,0,1,1.02,10.47,"23,000,000","412,909",1.80%,Analyze,
WNNR,Andretti Acquisition Corp.,3/7/2022,"$241,730,000 ",N,0,1,1.03,10.51,"23,000,000","141,816",0.62%,Analyze,
TOAC,Talon 1 Acquisition Corp. - Class A,12/30/2021,"$241,730,000 ",N,0,1.01,1.03,10.54,"23,000,000","210,924",0.92%,Analyze,
CITE,Cartica Acquisition Corp Class A,2/24/2022,"$241,960,000 ",N,0,1.01,1.03,10.53,"23,000,000","52,238",0.23%,Analyze,
TGR,Kimbell Tiger Acquisition Corporation Class A,3/28/2022,"$241,986,300 ",N,0,1,1.03,10.52,"23,002,500","128,913",0.56%,Analyze,
PLAO,Patria Latin American Opportunity Acquisition Corp. - Class A,5/4/2022,"$242,190,000 ",N,0,1,1.02,10.53,"23,000,000","3,732",0.02%,Analyze,
CLIM,Climate Real Impact Solutions II Acquisition Corporation Class A,3/19/2021,"$242,224,500 ",N,0,1,1.01,10.03,"24,150,000","16,725",0.07%,Analyze,
SVFB,SVF Investment Corp. 2 - Class A,3/9/2021,"$243,055,296 ",N,0,1,1.02,10.2,"23,760,000","116,042",0.49%,Analyze,
